{"$id":"https://schemas.micrantha.com/dubnium/v1/authorized-capability-manifest.schema.json","$schema":"https://json-schema.org/draft/2020-12/schema","additionalProperties":false,"allOf":[{"if":{"properties":{"capability":{"properties":{"name":{"const":"example.noop"},"schema_version":{"const":1}},"required":["name","schema_version"]}},"required":["capability"]},"then":{"properties":{"granted_constraints":{"additionalProperties":false,"properties":{"max_result_bytes":{"minimum":1,"type":"integer"}},"required":["max_result_bytes"],"type":"object"},"normalized_payload":{"$ref":"example-noop-payload.schema.json"}}}}],"description":"Immutable runtime-produced provider input bound to one normalized request and final governance decision.","properties":{"$schema":{"maxLength":512,"type":"string"},"actor_ref":{"$ref":"common.schema.json#/$defs/reference"},"capability":{"additionalProperties":false,"properties":{"name":{"maxLength":128,"pattern":"^[a-z][a-z0-9]*(?:\\.[a-z][a-z0-9-]*)+$","type":"string"},"schema_version":{"const":1}},"required":["name","schema_version"],"type":"object"},"contract_version":{"const":"1.0"},"decision":{"additionalProperties":false,"properties":{"decision_ref":{"$ref":"common.schema.json#/$defs/reference"},"expires_at":{"$ref":"common.schema.json#/$defs/timestamp"},"outcome":{"const":"allow"},"policy_ref":{"$ref":"common.schema.json#/$defs/reference"},"request_digest":{"$ref":"common.schema.json#/$defs/digest"}},"required":["decision_ref","request_digest","policy_ref","outcome","expires_at"],"type":"object"},"evidence_requirements":{"additionalProperties":false,"properties":{"before_execution":{"items":{"$ref":"common.schema.json#/$defs/reference"},"maxItems":16,"type":"array","uniqueItems":true},"completion":{"items":{"$ref":"common.schema.json#/$defs/reference"},"maxItems":16,"type":"array","uniqueItems":true}},"required":["before_execution","completion"],"type":"object"},"expires_at":{"$ref":"common.schema.json#/$defs/timestamp"},"granted_constraints":{"$ref":"common.schema.json#/$defs/jsonObject","maxProperties":32},"issued_at":{"$ref":"common.schema.json#/$defs/timestamp"},"manifest_id":{"$ref":"common.schema.json#/$defs/reference"},"normalized_payload":{"$ref":"common.schema.json#/$defs/jsonObject","maxProperties":64},"normalized_payload_digest":{"$ref":"common.schema.json#/$defs/digest"},"request_digest":{"$ref":"common.schema.json#/$defs/digest"},"request_id":{"$ref":"common.schema.json#/$defs/requestId"},"target_ref":{"$ref":"common.schema.json#/$defs/reference"}},"required":["contract_version","manifest_id","request_id","request_digest","actor_ref","capability","target_ref","normalized_payload","normalized_payload_digest","decision","granted_constraints","evidence_requirements","issued_at","expires_at"],"title":"AuthorizedCapabilityManifest v1","type":"object"}
