{"actor_ref":"workload:synthetic-client","capability":{"name":"example.noop","schema_version":1},"contract_version":"1.0","decision":{"decision_ref":"decision:synthetic:001","expires_at":"2099-01-01T00:00:00Z","outcome":"allow","policy_ref":"policy:synthetic:noop-v1","request_digest":"sha256:d74624c1ee49c193a4077e8833d91a9aaff1575bdcfc412a116153078d01059d"},"evidence_requirements":{"before_execution":["evidence:synthetic-ci:001"],"completion":["evidence:synthetic-result:required"]},"expires_at":"2099-01-01T00:00:00Z","granted_constraints":{"max_result_bytes":128},"issued_at":"2026-08-05T20:00:01Z","manifest_id":"manifest:synthetic:001","normalized_payload":{"message":"hello","repeat":2},"normalized_payload_digest":"sha256:ec63d22086cbed3a75979f56d3fff564ea80b192dc8c14fc40f6c8c7d28c7e0b","request_digest":"sha256:d74624c1ee49c193a4077e8833d91a9aaff1575bdcfc412a116153078d01059d","request_id":"request-example-001","target_ref":"example:local"}
