{"$schema":"../../schemas/v1/authorized-capability-manifest.schema.json","actor_ref":"workload:synthetic-client","capability":{"name":"example.noop","schema_version":1},"contract_version":"1.0","decision":{"decision_ref":"decision:synthetic:001","expires_at":"2099-01-01T00:00:00Z","outcome":"allow","policy_ref":"policy:synthetic:noop-v1","request_digest":"sha256:0b5acd7911285ce29fba5d3bded3e3fb370bba5c956c6086c27e3e4cc39898bf"},"evidence_requirements":{"before_execution":["evidence:synthetic-ci:001"],"completion":["evidence:synthetic-result:required"]},"expires_at":"2099-01-01T00:00:00Z","granted_constraints":{"max_result_bytes":128},"issued_at":"2026-08-05T20:00:01Z","manifest_id":"manifest:synthetic:001","normalized_payload":{"message":"hello","repeat":2},"normalized_payload_digest":"sha256:516d7c32a0bda4cef508a98712c5e7bc7d58863638b8e704b0559a9ceaa4bc67","request_digest":"sha256:0b5acd7911285ce29fba5d3bded3e3fb370bba5c956c6086c27e3e4cc39898bf","request_id":"request-example-001","target_ref":"example:local"}
